<?xml version="1.0" encoding="UTF-8"?>
<!--Sample XML file generated by XMLSpy v2007 rel. 3 (http://www.altova.com)-->
<WifiNodes xsi:noNamespaceSchemaLocation="wifiNode.xsd" xmlns:xsi="http://www.w3.org/2001/XMLSchema-instance">
	<wifiFloor1>
		<wifiNodeBlock1>
			<_3DPosition>
				<x>1.0</x>
				<y>2.88</y>
				<z>4.0</z>
			</_3DPosition>
			<arbitraryDistance>5.0</arbitraryDistance>
			<macAddress>18:D6:C7:40:33:51</macAddress>
			<powerAtArbitraryDistance>-55.4.0</powerAtArbitraryDistance>
			<powerTransmit>-43.70</powerTransmit>
		</wifiNodeBlock1>
		<wifiNodeBlock2>
			<_3DPosition>
				<x>4.919</x>
				<y>1.0</y>
				<z>4.0</z>
			</_3DPosition>
			<arbitraryDistance>5.0</arbitraryDistance>
			<macAddress>8E:F5:A3:91:F5:06</macAddress>
			<powerAtArbitraryDistance>-51.58</powerAtArbitraryDistance>
			<powerTransmit>-45.40</powerTransmit>
		</wifiNodeBlock2>
		<wifiNodeBlock3>
			<_3DPosition>
				<x>3.830</x>
				<y>3.365</y>
				<z>4.0</z>
			</_3DPosition>
			<arbitraryDistance>5.0</arbitraryDistance>
			<macAddress>62:01:94:5E:4A:4E</macAddress>
			<powerAtArbitraryDistance>-52.37</powerAtArbitraryDistance>
			<powerTransmit>-47.72.0</powerTransmit>
		</wifiNodeBlock3>
		<wifiNodeBlock4>
			<_3DPosition>
				<x>1.097</x>
				<y>0.975</y>
				<z>4.0</z>
			</_3DPosition>
			<arbitraryDistance>5.0</arbitraryDistance>
			<macAddress>80:37:73:AC:E6:66</macAddress>
			<powerAtArbitraryDistance>-50.94</powerAtArbitraryDistance>
			<powerTransmit>-44.71</powerTransmit>
		</wifiNodeBlock4>
		<wifiNodeBlock5>
			<_3DPosition>
				<x>0.0</x>
				<y>0.0</y>
				<z>0.0</z>
			</_3DPosition>
			<arbitraryDistance>5.0</arbitraryDistance>
			<macAddress>ff:ff:ff:ff:ff:ff</macAddress>
			<powerAtArbitraryDistance>-65.0</powerAtArbitraryDistance>
			<powerTransmit>-50.0</powerTransmit>
		</wifiNodeBlock5>
		<wifiNodeBlock6>
			<_3DPosition>
				<x>0.0</x>
				<y>0.0</y>
				<z>0.0</z>
			</_3DPosition>
			<arbitraryDistance>5.0</arbitraryDistance>
			<macAddress>ff:ff:ff:ff:ff:ff</macAddress>
			<powerAtArbitraryDistance>-65.0</powerAtArbitraryDistance>
			<powerTransmit>-50.0</powerTransmit>
		</wifiNodeBlock6>
		<wifiNodeBlock7>
			<_3DPosition>
				<x>0.0</x>
				<y>0.0</y>
				<z>0.0</z>
			</_3DPosition>
			<arbitraryDistance>5.0</arbitraryDistance>
			<macAddress>ff:ff:ff:ff:ff:ff</macAddress>
			<powerAtArbitraryDistance>-65.0</powerAtArbitraryDistance>
			<powerTransmit>-50.0</powerTransmit>
		</wifiNodeBlock7>
		<wifiNodeBlock8>
			<_3DPosition>
				<x>0.0</x>
				<y>0.0</y>
				<z>0.0</z>
			</_3DPosition>
			<arbitraryDistance>5.0</arbitraryDistance>
			<macAddress>ff:ff:ff:ff:ff:ff</macAddress>
			<powerAtArbitraryDistance>-65.0</powerAtArbitraryDistance>
			<powerTransmit>-50.0</powerTransmit>
		</wifiNodeBlock8>
		<wifiNodeBlock9>
			<_3DPosition>
				<x>0.0</x>
				<y>0.0</y>
				<z>0.0</z>
			</_3DPosition>
			<arbitraryDistance>5.0</arbitraryDistance>
			<macAddress>ff:ff:ff:ff:ff:ff</macAddress>
			<powerAtArbitraryDistance>-65.0</powerAtArbitraryDistance>
			<powerTransmit>-50.0</powerTransmit>
		</wifiNodeBlock9>
		<wifiNodeBlock10>
			<_3DPosition>
				<x>0.0</x>
				<y>0.0</y>
				<z>0.0</z>
			</_3DPosition>
			<arbitraryDistance>5.0</arbitraryDistance>
			<macAddress>ff:ff:ff:ff:ff:ff</macAddress>
			<powerAtArbitraryDistance>-65.0</powerAtArbitraryDistance>
			<powerTransmit>-50.0</powerTransmit>
		</wifiNodeBlock10>
		<wifiNodeBlock11>
			<_3DPosition>
				<x>0.0</x>
				<y>0.0</y>
				<z>0.0</z>
			</_3DPosition>
			<arbitraryDistance>5.0</arbitraryDistance>
			<macAddress>ff:ff:ff:ff:ff:ff</macAddress>
			<powerAtArbitraryDistance>-65.0</powerAtArbitraryDistance>
			<powerTransmit>-50.0</powerTransmit>
		</wifiNodeBlock11>
		<wifiNodeBlock12>
			<_3DPosition>
				<x>0.0</x>
				<y>0.0</y>
				<z>0.0</z>
			</_3DPosition>
			<arbitraryDistance>5.0</arbitraryDistance>
			<macAddress>ff:ff:ff:ff:ff:ff</macAddress>
			<powerAtArbitraryDistance>-65.0</powerAtArbitraryDistance>
			<powerTransmit>-50.0</powerTransmit>
		</wifiNodeBlock12>
		<wifiNodeBlock13>
			<_3DPosition>
				<x>0.0</x>
				<y>0.0</y>
				<z>0.0</z>
			</_3DPosition>
			<arbitraryDistance>5.0</arbitraryDistance>
			<macAddress>ff:ff:ff:ff:ff:ff</macAddress>
			<powerAtArbitraryDistance>-65.0</powerAtArbitraryDistance>
			<powerTransmit>-50.0</powerTransmit>
		</wifiNodeBlock13>
		<wifiNodeBlock14>
			<_3DPosition>
				<x>0.0</x>
				<y>0.0</y>
				<z>0.0</z>
			</_3DPosition>
			<arbitraryDistance>5.0</arbitraryDistance>
			<macAddress>ff:ff:ff:ff:ff:ff</macAddress>
			<powerAtArbitraryDistance>-65.0</powerAtArbitraryDistance>
			<powerTransmit>-50.0</powerTransmit>
		</wifiNodeBlock14>
		<wifiNodeBlock15>
			<_3DPosition>
				<x>0.0</x>
				<y>0.0</y>
				<z>0.0</z>
			</_3DPosition>
			<arbitraryDistance>5.0</arbitraryDistance>
			<macAddress>ff:ff:ff:ff:ff:ff</macAddress>
			<powerAtArbitraryDistance>-65.0</powerAtArbitraryDistance>
			<powerTransmit>-50.0</powerTransmit>
		</wifiNodeBlock15>
	</wifiFloor1>
	<wifiFloor2>
		<wifiNodeBlock1>
			<_3DPosition>
				<x>0.0</x>
				<y>0.0</y>
				<z>0.0</z>
			</_3DPosition>
			<arbitraryDistance>5.0</arbitraryDistance>
			<macAddress>ff:ff:ff:ff:ff:ff</macAddress>
			<powerAtArbitraryDistance>-65.0</powerAtArbitraryDistance>
			<powerTransmit>-50.0</powerTransmit>
		</wifiNodeBlock1>
		<wifiNodeBlock2>
			<_3DPosition>
				<x>0.0</x>
				<y>0.0</y>
				<z>0.0</z>
			</_3DPosition>
			<arbitraryDistance>5.0</arbitraryDistance>
			<macAddress>ff:ff:ff:ff:ff:ff</macAddress>
			<powerAtArbitraryDistance>-65.0</powerAtArbitraryDistance>
			<powerTransmit>-50.0</powerTransmit>
		</wifiNodeBlock2>
		<wifiNodeBlock3>
			<_3DPosition>
				<x>0.0</x>
				<y>0.0</y>
				<z>0.0</z>
			</_3DPosition>
			<arbitraryDistance>5.0</arbitraryDistance>
			<macAddress>ff:ff:ff:ff:ff:ff</macAddress>
			<powerAtArbitraryDistance>-65.0</powerAtArbitraryDistance>
			<powerTransmit>-50.0</powerTransmit>
		</wifiNodeBlock3>
		<wifiNodeBlock4>
			<_3DPosition>
				<x>0.0</x>
				<y>0.0</y>
				<z>0.0</z>
			</_3DPosition>
			<arbitraryDistance>5.0</arbitraryDistance>
			<macAddress>ff:ff:ff:ff:ff:ff</macAddress>
			<powerAtArbitraryDistance>-65.0</powerAtArbitraryDistance>
			<powerTransmit>-50.0</powerTransmit>
		</wifiNodeBlock4>
		<wifiNodeBlock5>
			<_3DPosition>
				<x>0.0</x>
				<y>0.0</y>
				<z>0.0</z>
			</_3DPosition>
			<arbitraryDistance>5.0</arbitraryDistance>
			<macAddress>ff:ff:ff:ff:ff:ff</macAddress>
			<powerAtArbitraryDistance>-65.0</powerAtArbitraryDistance>
			<powerTransmit>-50.0</powerTransmit>
		</wifiNodeBlock5>
		<wifiNodeBlock6>
			<_3DPosition>
				<x>0.0</x>
				<y>0.0</y>
				<z>0.0</z>
			</_3DPosition>
			<arbitraryDistance>5.0</arbitraryDistance>
			<macAddress>ff:ff:ff:ff:ff:ff</macAddress>
			<powerAtArbitraryDistance>-65.0</powerAtArbitraryDistance>
			<powerTransmit>-50.0</powerTransmit>
		</wifiNodeBlock6>
		<wifiNodeBlock7>
			<_3DPosition>
				<x>0.0</x>
				<y>0.0</y>
				<z>0.0</z>
			</_3DPosition>
			<arbitraryDistance>5.0</arbitraryDistance>
			<macAddress>ff:ff:ff:ff:ff:ff</macAddress>
			<powerAtArbitraryDistance>-65.0</powerAtArbitraryDistance>
			<powerTransmit>-50.0</powerTransmit>
		</wifiNodeBlock7>
		<wifiNodeBlock8>
			<_3DPosition>
				<x>0.0</x>
				<y>0.0</y>
				<z>0.0</z>
			</_3DPosition>
			<arbitraryDistance>5.0</arbitraryDistance>
			<macAddress>ff:ff:ff:ff:ff:ff</macAddress>
			<powerAtArbitraryDistance>-65.0</powerAtArbitraryDistance>
			<powerTransmit>-50.0</powerTransmit>
		</wifiNodeBlock8>
		<wifiNodeBlock9>
			<_3DPosition>
				<x>0.0</x>
				<y>0.0</y>
				<z>0.0</z>
			</_3DPosition>
			<arbitraryDistance>5.0</arbitraryDistance>
			<macAddress>ff:ff:ff:ff:ff:ff</macAddress>
			<powerAtArbitraryDistance>-65.0</powerAtArbitraryDistance>
			<powerTransmit>-50.0</powerTransmit>
		</wifiNodeBlock9>
		<wifiNodeBlock10>
			<_3DPosition>
				<x>0.0</x>
				<y>0.0</y>
				<z>0.0</z>
			</_3DPosition>
			<arbitraryDistance>5.0</arbitraryDistance>
			<macAddress>ff:ff:ff:ff:ff:ff</macAddress>
			<powerAtArbitraryDistance>-65.0</powerAtArbitraryDistance>
			<powerTransmit>-50.0</powerTransmit>
		</wifiNodeBlock10>
		<wifiNodeBlock11>
			<_3DPosition>
				<x>0.0</x>
				<y>0.0</y>
				<z>0.0</z>
			</_3DPosition>
			<arbitraryDistance>5.0</arbitraryDistance>
			<macAddress>ff:ff:ff:ff:ff:ff</macAddress>
			<powerAtArbitraryDistance>-65.0</powerAtArbitraryDistance>
			<powerTransmit>-50.0</powerTransmit>
		</wifiNodeBlock11>
		<wifiNodeBlock12>
			<_3DPosition>
				<x>0.0</x>
				<y>0.0</y>
				<z>0.0</z>
			</_3DPosition>
			<arbitraryDistance>5.0</arbitraryDistance>
			<macAddress>ff:ff:ff:ff:ff:ff</macAddress>
			<powerAtArbitraryDistance>-65.0</powerAtArbitraryDistance>
			<powerTransmit>-50.0</powerTransmit>
		</wifiNodeBlock12>
		<wifiNodeBlock13>
			<_3DPosition>
				<x>0.0</x>
				<y>0.0</y>
				<z>0.0</z>
			</_3DPosition>
			<arbitraryDistance>5.0</arbitraryDistance>
			<macAddress>ff:ff:ff:ff:ff:ff</macAddress>
			<powerAtArbitraryDistance>-65.0</powerAtArbitraryDistance>
			<powerTransmit>-50.0</powerTransmit>
		</wifiNodeBlock13>
		<wifiNodeBlock14>
			<_3DPosition>
				<x>0.0</x>
				<y>0.0</y>
				<z>0.0</z>
			</_3DPosition>
			<arbitraryDistance>5.0</arbitraryDistance>
			<macAddress>ff:ff:ff:ff:ff:ff</macAddress>
			<powerAtArbitraryDistance>-65.0</powerAtArbitraryDistance>
			<powerTransmit>-50.0</powerTransmit>
		</wifiNodeBlock14>
		<wifiNodeBlock15>
			<_3DPosition>
				<x>0.0</x>
				<y>0.0</y>
				<z>0.0</z>
			</_3DPosition>
			<arbitraryDistance>5.0</arbitraryDistance>
			<macAddress>ff:ff:ff:ff:ff:ff</macAddress>
			<powerAtArbitraryDistance>-65.0</powerAtArbitraryDistance>